{
  "schema_version": "0.1.0",
  "protocol_version": "0.1.0",
  "migration_id": "migration-event-001",
  "created_at": "2026-08-26T14:00:00Z",
  "source_record_id": "evt-legacy-001",
  "source_content_hash": "sha256:cccccccccccccccccccccccccccccccccccccccccccccccccccccccccccccccc",
  "from_contract_set": "b8tp=0.1.0,evidence=0.1.0,validator=0.1.0",
  "to_contract_set": "b8tp=0.2.0,evidence=0.2.0,validator=0.2.0",
  "migrated_record_id": "evt-migrated-001",
  "migration_version": "0.2.0",
  "original_preserved": true
}
